{
  "version": "0.1.0",
  "lastUpdate": "2026-10-01T00:00:00.000Z",
  "count": 53,
  "source": "https://observatorioia.org",
  "license": "CC BY 4.0",
  "data": [
    {
      "fecha": "2026-10-01",
      "tipo": "proyecto",
      "actualizacion": {
        "es": "Se incorporan MuniBot de Cartago y el asistente virtual del MICITT como adopciones verificadas: las fuentes oficiales identifican IA generativa y la comprobación funcional puntual obtuvo respuesta de ambos asistentes. Esta prueba no acredita precisión general, eficacia ni todos los controles declarados.",
        "en": "Cartago's MuniBot and MICITT's virtual assistant are added as verified adoptions: official sources identify generative AI and a point-in-time functional check obtained responses from both assistants. This check does not establish general accuracy, effectiveness or all declared safeguards."
      },
      "fuente": {
        "es": "Declaraciones oficiales de Cartago y MICITT",
        "en": "Official statements by Cartago and MICITT"
      },
      "fuente_url": "https://www.muni-carta.go.cr/declaracion-de-uso-de-inteligencia-artificial/"
    },
    {
      "fecha": "2026-10-01",
      "tipo": "proyecto",
      "actualizacion": {
        "es": "Se añaden cuatro iniciativas en seguimiento: Vincent AI del INVU, soluciones de IA para Auditoría Interna del SBD, R.O.D.U de La Unión y el asistente Dejar de Fumar y Vapear de Salud, CCSS e IAFA. Las dos primeras tienen evidencia contractual sin uso operativo acreditado; las otras dos documentan servicios existentes, pero no una técnica de IA determinada. El corte alcanza 38 iniciativas en 16 instituciones: 9 verificadas, 13 en seguimiento y 16 de ecosistema.",
        "en": "Four initiatives are added under review: INVU's Vincent AI, SBD Internal Audit's AI solutions, La Unión's R.O.D.U and the Quit Smoking and Vaping assistant from Health, CCSS and IAFA. The first two have contractual evidence without verified operational use; the other two document existing services but not a determined AI technique. The release covers 38 initiatives across 16 institutions: 9 verified, 13 under review and 16 ecosystem initiatives."
      },
      "fuente": {
        "es": "SICOP y documentación institucional citada en cada ficha",
        "en": "SICOP and institutional documentation cited in each record"
      },
      "fuente_url": "https://www.sicop.go.cr/moduloPcont/pcont/ctract/es/CE_CEJ_ESQ002.jsp?cartelNo=20260803608&cartelSeq=00"
    },
    {
      "fecha": "2026-10-01",
      "tipo": "recurso",
      "actualizacion": {
        "es": "La nota de la intervención ENIA del IFAM para gobiernos locales reconoce evidencia municipal adyacente de Cartago y La Unión. No se acredita vinculación con IFAM ni cumplimiento de su meta; el cruce y la ejecución permanecen sin verificar. No se reclasifican ICE/OIJ ni AyA, ni se renuevan fechas de frentes no revisados.",
        "en": "The note on IFAM's ENIA intervention for local governments acknowledges adjacent municipal evidence from Cartago and La Unión. No link to IFAM or fulfillment of its target is established; the match and execution remain unverified. ICE/OIJ and AyA are not reclassified, and review dates for unreviewed areas are not renewed."
      },
      "fuente": {
        "es": "Declaración municipal de Cartago y documentación de La Unión",
        "en": "Cartago's municipal statement and La Unión documentation"
      },
      "fuente_url": "https://launion.go.cr/noticias/que-es-r-o-d-u/"
    },
    {
      "fecha": "2026-09-15",
      "tipo": "proyecto",
      "actualizacion": {
        "es": "Se incorpora en seguimiento el proyecto interinstitucional de MICITT, MTSS e INA para fortalecer la plataforma del Sistema Nacional de Empleo mediante IA. La contratación adjudicada a WCC Group B.V. confirma la etapa I de diseño y planificación, pero no acredita todavía el desarrollo ni la operación del motor de IA. La intervención ENIA del INA pasa a coincidencia parcial y conserva ejecución no verificada.",
        "en": "The inter-institutional MICITT, MTSS and INA project to strengthen the National Employment System platform with AI is added under review. The procurement awarded to WCC Group B.V. confirms stage I design and planning but does not yet establish development or operation of the AI engine. INA's ENIA intervention moves to a partial match and remains unverified for execution."
      },
      "fuente": {
        "es": "INA, documentación institucional del proyecto SNE",
        "en": "INA, institutional documentation for the SNE project"
      },
      "fuente_url": "https://www.ina.ac.cr/transparencia/Documentos%20compartidos/Informes%20Institucionales/Hist%C3%B3rico%20de%20los%20informes%20anuales%20de%20auditor%C3%ADa%20interna/2025/Informes_AS/AI-ASE-03-2025-Adenda_Convenio_MICITT-INA-MTSS-JD.pdf"
    },
    {
      "fecha": "2026-09-08",
      "tipo": "proyecto",
      "actualizacion": {
        "es": "La ficha Clasificación documental de cobros adopta el nombre institucional Tipificador de Escritos y pasa de piloto a operativo. Fuentes oficiales confirman aprendizaje automático y reconocimiento óptico de caracteres, implantación en toda la jurisdicción cobratoria, 1.302.899 escritos procesados en 2024 y reglas de retroalimentación y clasificación manual de respaldo vigentes en 2026.",
        "en": "The Document Classification for Debt Collection record adopts the institutional name Filing Classifier and moves from pilot to operational. Official sources confirm machine learning and optical character recognition, deployment across the entire debt collection jurisdiction, 1,302,899 filings processed in 2024, and feedback and manual-fallback rules in force in 2026."
      },
      "fuente": {
        "es": "Poder Judicial, evidencia institucional del Tipificador de Escritos",
        "en": "Judicial Branch, institutional evidence for the Filing Classifier"
      },
      "fuente_url": "https://actualidadjudicial.poder-judicial.go.cr/vol294/noticias_judiciales/nj4-294.html"
    },
    {
      "fecha": "2026-09-01",
      "tipo": "proyecto",
      "actualizacion": {
        "es": "Se incorpora Clara, el asistente virtual de ARESEP, como adopción verificada. Las fuentes oficiales confirman que opera en el sitio institucional con IA generativa, Microsoft Copilot Studio y una base de conocimiento de más de 730 archivos públicos; los resultados y métricas de calidad permanecen no determinados.",
        "en": "Clara, ARESEP's virtual assistant, is added as a verified adoption. Official sources confirm that it operates on the institutional website using generative AI, Microsoft Copilot Studio and a knowledge base of more than 730 public files; outcomes and quality metrics remain undetermined."
      },
      "fuente": {
        "es": "ARESEP, lanzamiento oficial y declaración de uso de IA",
        "en": "ARESEP, official launch and AI use statement"
      },
      "fuente_url": "https://aresep.go.cr/noticias/aresep-lanza-asistente-virtual-para-sitio-web/"
    },
    {
      "fecha": "2026-09-01",
      "tipo": "proyecto",
      "actualizacion": {
        "es": "Se incorpora en seguimiento la línea del INVU para usar aplicaciones de IA en planificación territorial. El comunicado oficial confirma el objetivo, pero no permite determinar aplicaciones, técnica, proveedor, contratación, piloto o uso operativo, ni relacionar por inferencia la IA con los 23 planes reguladores mencionados por separado.",
        "en": "INVU's effort to use AI applications in territorial planning is added under review. The official release confirms the objective but does not establish the applications, technique, vendor, procurement, pilot or operational use, nor does it support inferring a link between AI and the 23 regulatory plans mentioned separately."
      },
      "fuente": {
        "es": "INVU, comunicado oficial sobre INVU Evoluciona",
        "en": "INVU, official INVU Evoluciona release"
      },
      "fuente_url": "https://www.invu.go.cr/-/72-aniversario?inheritRedirect=true&redirect=%2Fhome"
    },
    {
      "fecha": "2026-09-01",
      "tipo": "recurso",
      "actualizacion": {
        "es": "Se actualizan las notas de las dos intervenciones ENIA del INVU con evidencia institucional adyacente: el POI 2025 documenta ajustes al pliego de una contratación para automatización mediante IA y el Presupuesto Inicial 2026 mantiene IA y bots dentro de bienes intangibles. Ambas acciones conservan ejecución no verificada y el monto total de esa partida no se atribuye a IA.",
        "en": "Notes for the two INVU ENIA interventions are updated with adjacent institutional evidence: the 2025 POI documents tender-document adjustments for AI-enabled automation, and the 2026 Initial Budget retains AI and bots within intangible assets. Both actions remain unverified for execution, and the total amount of that budget category is not attributed to AI."
      },
      "fuente": {
        "es": "INVU, seguimiento semestral del POI 2025 y Presupuesto Inicial 2026",
        "en": "INVU, 2025 POI midyear monitoring and 2026 Initial Budget"
      },
      "fuente_url": "https://www.invu.go.cr/documents/20181/621840/Informe%2BSemestral%2BEvaluaci%C3%B3n%2BPOI%2Ba%2Bjunio%2B2025"
    },
    {
      "fecha": "2026-08-24",
      "tipo": "recurso",
      "actualizacion": {
        "es": "Se corrige el flujo de agenda editorial: la anticipación se ajusta por cadencia y días hábiles; los issues se crean sin aviso inicial y el watcher notifica solo cuando existe un veredicto; cada revisión exige la URL del issue y el cierre ocurre después de que CI valida el cambio en main. La API R10 separa la bitácora rodante de monitoreo de los once datasets sustantivos congelados y preserva R8 y R9 sin cambios.",